<?xml version="1.0" encoding="utf-8"?><!DOCTYPE stage SYSTEM "MosMtr/dtd/stage.dtd"><stage code="E_learning_Securite_Incendie__SCORM_2004____220320" type="scorm" cacherBoutonsLMS="non" suiviParcours="oui" nomRacine="E-learning_Sécurité_Incendie_(SCORM_2004)_-_22032021_ORG"><titre>Evacuation des personnes en situation de handicap</titre><metadata dateCreation="2021-03-26T12:57" catalogue="Catalog" version="1" statut="final" cout="yes" droits="yes" dateMAJ="2021-03-30T13:19" tempsPrevu="PT20M"><description>Cet item obligatoire t'expliquera comment évacuer une personne en situation de handicap. Une attestation sera à archiver dans ton registre d'accessibilité.</description><motsCles><motCle /></motsCles><contribs><contrib role="author" /></contribs></metadata><sequence utiliserInfoObjCourant="oui" utiliserInfoProgCourant="oui" /><modules><etape code="E-learning_Sécurité_Incendie_SCO" type="reference" href="index_lms.html" codeMasque="E-learning_S%C3%A9curit%C3%A9_Incendie_SCO"><nom>E-learning Sécurité Incendie (SCORM 2004) - 22032021</nom><metadata dateCreation="2021-03-26T12:57" dateMAJ="2021-03-26T13:00" statut="final" tempsPrevu="PT20M"><description>Cet item obligatoire t'expliquera comment évacuer une personne en situation de handicap. Une attestation sera à archiver dans ton registre d'accessibilité.</description><motsCles><motCle>évacuation</motCle><motCle>handicap</motCle></motsCles><contribs><contrib role="author" label="Emmanuelle CRESTA">
N:CRESTA;Emmanuelle
FN:Emmanuelle CRESTA
EMAIL;PREF;INTERNET:e.cresta@kiabi.com</contrib></contribs></metadata></etape></modules></stage>